{
  "$schema": "https://raw.githubusercontent.com/Soleone/showcase/main/schema/showcase.schema.json",
  "title": "showcase",
  "pitch": "Grade how demoable a project is, from D to S, and get the exact next steps to raise it.",
  "description": "Checks the README, media, showcase.json and demo against five tiers and lists what is missing. Comes with an agent skill that does the fixing and a collect command that feeds a portfolio site.",
  "kind": "cli",
  "year": 2026,
  "tech": ["Node.js"],
  "repo": "https://github.com/Soleone/showcase",
  "media": {
    "hero": "docs/media/hero.png",
    "motion": "docs/media/demo.webp",
    "capture": "npm run media:capture"
  },
  "demo": {
    "strategy": "browser-terminal",
    "local": "npm run demo",
    "externals": []
  }
}
